question	answer	answer_number	equation_solution
Frage: Roger hat 5 Tennisbälle. Er kauft noch 2 Dosen Tennisbälle. In jeder Dose sind 3 Tennisbälle. Wie viele Tennisbälle hat er jetzt?	Schritt-für-Schritt-Antwort: Roger begann mit 5 Bällen. 2 Dosen von jeweils 3 Tennisbällen macht 6 Tennisbälle. 5 + 6 = 11. Die Antwort ist 11.	11	5 + 6 = 11.
Frage: Es waren neun Computer im Serverraum. Von Montag bis Donnerstag wurden jeden Tag noch fünf Computer installiert. Wie viele Computer sind jetzt im Serverraum?	Schritt-für-Schritt-Antwort: Von Montag bis Donnerstag sind es 4 Tage. Jeden Tag kamen 5 neue Computer hinzu. Das macht insgesamt 4 x 5 = 20 Computer, die hinzugefügt wurden. Am Anfang waren es 9 Computer, also sind es jetzt 9 + 20 =29 Computer. Die Antwort lautet 29.	29	4 * 5 = 20. 9 + 20 = 29.
Frage: Leah hat 32 Pralinen und ihre Schwester hat 42. Wenn sie 35 essen, wie viele sind dann insgesamt noch übrig?	Schritt-für-Schritt-Antwort: Leah hat 32 Pralinen und Leahs Schwester 42. Das bedeutet, dass es ursprünglich 32 + 42 =74 Pralinen waren. 35 wurden gegessen. Also haben sie insgesamt noch 74 - 35 = 39 Pralinen übrig. Die Antwort lautet 39.	39	32 + 42 = 74. 74 - 35 = 39.
Frage: Shawn hat fünf Spielzeuge. Zu Weihnachten hat er von seiner Mama und seinem Papa jeweils zwei Spielzeuge bekommen. Wie viele Spielzeuge hat er jetzt?	Schritt-für-Schritt-Antwort: Er hat 5 Spielzeuge. Er hat 2 von seiner Mama bekommen, sodass er nun 5 + 2 = 7 Spielzeuge hat. Dann hat er noch 2 von seinem Papa bekommen, also hat er insgesamt 7 + 2 = 9 Spielzeuge. Die Antwort lautet 9.	9	5 + 2 = 7. 7 + 2 = 9.
Frage: Michael hat 58 Golfbälle. Am Dienstag hat er 23 Golfbälle verloren. Am Mittwoch hat er 2 weitere verloren. Wie viele Golfbälle hat er Mittwoch am Ende des Tages?	Schritt-für-Schritt-Antwort: Michael hatte anfangs 58 Golfbälle und hat 23 verloren, sodass er 58 - 23 = 35 hat. Nachdem er 2 weitere verloren hat, hat er jetzt 35 - 2 = 33 Bälle. Die Antwort lautet 33.	33	58 - 23 = 35. 35 - 2 = 33.
Frage: Olivia hat 23 US-Dollar. Sie hat fünf Bagels für 3 US-Dollar pro Stück gekauft. Wie viel Geld hat sie übrig?	Schritt-für-Schritt-Antwort: 5 Bagels für 3 US-Dollar pro Stück kosten 5 x 3 = 15 Dollar. Olivia hat anfangs 23 US-Dollar, also hat sie jetzt 23 - 15 = 8 Dollar übrig. Die Antwort lautet 8.	8	5 * 3 = 15. 23 - 15 = 8.
Frage: Jason hatte 20 Lutscher. Er hat Denny einige Lutscher gegeben. Jetzt hat Jason 12 Lutscher. Wie viele Lutscher hat Jason Denny gegeben?	Schritt-für-Schritt-Antwort: Jason hat mit 20 Lutschern angefangen, aber jetzt hat er nur 12, also hat er Denny 20 - 12 = 8 Lutscher abgegeben. Die Antwort lautet 8.	8	20 - 12 = 8.
Frage: Wenn 3 Autos auf dem Parkplatz stehen und 2 weitere Autos ankommen, wie viele Autos stehen dann auf dem Parkplatz?	Schritt-für-Schritt-Antwort: Anfangs sind 3 Autos da, 2 weitere kommen an, also sind jetzt 3 + 2 = 5 Autos da. Die Antwort lautet 5.	5	3 + 2 = 5.
